id,link,source,type,title,summary,content,publishDate,tags,author,category,image
33,https://www.digitaltrends.com/gaming/phoenix-labs-dauntless-fae-farm-layoffs-100-workers/,Digital Trends,News Article,Dauntless dev lays off over 100 people as it cancels in-development projects,Phoenix Labs confirmed that it was restructuring its business and laying off workers. This is the third such announcement in little over a year.,"Phoenix Labs
Phoenix Labs is seeing its third round of layoffs in just over a year. According to reports, over 100 people were affected this time around and projects have been canceled.
The company… [+1690 chars]",2024-05-16T19:21:26Z,N/A,Carli Velocci,N/A,https://www.digitaltrends.com/wp-content/uploads/2020/05/dauntless-crossplay.jpg?resize=1200%2C630&p=1
34,https://boehs.org/node/bountysource,Boehs.org,News Article,"Bountysource Stole at Least $17,000 from Open Source Developers",This is why people say the open source ecosystem sucks.,"in
blog
tags
date
5/3/2024
I like open source. I like the idea of gifts to the commons. I like the idealism, this naïve belief that if we all do our part, we can make beautiful things together. … [+3125 chars]",2024-05-03T23:40:27Z,N/A,Evan Boehs,N/A,https://boehs.org/og/node/bountysource.png
35,https://blog.kraken.com/crypto-education/opinion-why-there-will-never-be-another-bitcoin,Kraken.com,News Article,Why there will never be another Bitcoin,"On October 31, 2008, an unknown coder named Satoshi Nakamoto published a paper that laid the foundation for an entirely new monetary system – 15 years later, the world is only just catching on to its true value and potential.","By Pete Rizzo, Kraken Editor at Large
Pete Rizzo is a leading Bitcoin Historian and author of over 2,000 articles on cryptocurrency. He is also an Editor at Bitcoin Magazine.
The views and opinions… [+12052 chars]",2024-04-19T22:44:38Z,N/A,", KrakenFX",N/A,https://blog.kraken.com/wp-content/uploads/2023/09/Blog-BTC.png
36,https://paper.wf/crypto-agorism/the-dangers-of-decentralized-id-systems,Paper.wf,News Article,"The dangers of ""decentralized"" ID systems","Many decentralized identity protocols are being developed, which claim to increase users’ privacy, enable interoperability and convenient...","Many decentralized identity protocols are being developed, which claim to increase users privacy, enable interoperability and convenient single sign-ons, protect against identity theft and allow self… [+13534 chars]",2024-04-21T19:30:33Z,N/A,crypto-agorism,N/A,https://paper.wf/img/avatars/c.png
37,https://www.bitsaboutmoney.com/archive/the-business-of-wallets/,Bitsaboutmoney.com,News Article,The business of wallets,"How digital wallets work, and how payment costs drive a lot of product decisions inside and around them.","One of the best series of credit card commercials was the now-classic Capital One Whats in your wallet?, which reimagined the user as either an observer of or participant in family-friendly Viking ra… [+31375 chars]",2024-05-02T12:24:13Z,N/A,Patrick McKenzie (patio11),N/A,https://www.bitsaboutmoney.com/content/images/2024/05/business-of-wallets-logo.webp
38,https://www.marketwatch.com/story/crypto-industrys-lobbying-hit-a-record-in-2023-and-is-off-to-a-strong-start-in-2024-fa740b43,MarketWatch,News Article,Crypto industry’s lobbying hit a record in 2023 — and is off to a strong start in 2024,"The cryptocurrency industry’s spending on Washington lobbying rose to a fresh record last year, while it’s started out 2024 with more sizable spending to influence the U.S. government.","The cryptocurrency industrys spending on Washington lobbying rose to a fresh record again last year with companies and trade associations shelling out nearly $25 million, beating 2022s total of more … [+2801 chars]",2024-05-10T12:00:00Z,N/A,Victor Reklaitis,N/A,https://images.mktw.net/im-61553693/social
39,https://www.sciencedaily.com/releases/2024/05/240510111420.htm,Science Daily,News Article,Blockchain could offer a solution to the UK's transport ticketing systems,"A new approach to transport ticketing offers a step towards an integrated, transparent system that works efficiently for both ticket providers and passengers across all modes of transport.","A new approach to transport ticketing offers a step towards an integrated, transparent system that works efficiently for both ticket providers and passengers across all modes of transport.Traditional… [+2902 chars]",2024-05-10T15:14:20Z,N/A,N/A,N/A,https://www.sciencedaily.com/images/scidaily-icon.png
40,https://www.theregister.com/2024/05/14/biden_mineone_cryptocurrency/,Theregister.com,News Article,A Chinese crypto farm next to a nuclear missile base? Not on my watch says Biden,"White House contends MineOne's equipment could be used to for surveillance and espionage
If you're a majority Chinese-owned company looking for cheap real estate in the US, you might want to steer clear of American missile silos and military bases.…","If you're a majority Chinese-owned company looking for cheap real estate in the US, you might want to steer clear of American missile silos and military bases.
Cryptomining firm MineOne found this o… [+2492 chars]",2024-05-14T23:30:09Z,N/A,Tobias Mann,N/A,https://regmedia.co.uk/2024/02/01/shutterstock_biden.jpg
41,https://www.theregister.com/2024/05/18/distros_ai_code/,Theregister.com,News Article,"Gentoo and NetBSD ban 'AI' code, but Debian doesn't – yet","The problem isn't just that LLM-bot generated code is bad – it's where it came from
Comment The Debian project has decided against joining Gentoo Linux and NetBSD in rejecting program code generated with the assistance of LLM tools, such as Github's Copilot.…","Comment The Debian project has decided against joining Gentoo Linux and NetBSD in rejecting program code generated with the assistance of LLM tools, such as Github's Copilot.
The first FOSS OS proje… [+13403 chars]",2024-05-18T08:34:13Z,N/A,Liam Proven,N/A,https://regmedia.co.uk/2019/02/18/shutterstock_penguin_hug.jpg
42,https://ritholtz.com/2024/04/transcript-ashish-shah/,Ritholtz.com,News Article,"Transcript: Ashish Shah, CIO GSAM","﻿     The transcript from this week’s, MiB: Ashish Shah, CIO, Public Investing, Goldman Sachs Asset Management, is below. You can stream and download our full conversation, including any podcast extras, on Apple Podcasts, Spotify, YouTube, and Bloomberg. All …","The transcript from this weeks, MiB: Ashish Shah, CIO, Public Investing, Goldman Sachs Asset Management, is below.
You can stream and download our full conversation, including any podcast extras, on… [+62202 chars]",2024-04-23T12:30:02Z,N/A,Barry Ritholtz,N/A,https://ritholtz.com/wp-content/uploads/2023/02/Mib-tile.png
43,https://petapixel.com/2024/05/15/photo-mechanic-integrates-content-credentials-to-fight-fake-imagery/,PetaPixel,News Article,Photo Mechanic Integrates Content Credentials to Fight Fake Imagery,"Camera Bits are introducing C2PA Content Credentials technology into Photo Mechanic to help in the fight against disinformation.
[Read More]","Camera Bits are introducing C2PA Content Credentials technology into Photo Mechanic to help in the fight against disinformation. 
The image provenance system will soon be available as an option to t… [+2762 chars]",2024-05-15T17:20:43Z,N/A,Matt Growcoot,N/A,https://petapixel.com/assets/uploads/2024/05/Camera-Bits-C2PA.jpg
44,https://www.techmeme.com/240419/p11,Techmeme.com,News Article,Telegram partners with Tether to let the messaging app's ~900M users send USDT to each other through The Open Network blockchain (Ryan Browne/CNBC),"Ryan Browne / CNBC:
Telegram partners with Tether to let the messaging app's ~900M users send USDT to each other through The Open Network blockchain  —  Stablecoin Tether and Circle's USDC dominate the market.  —  Telegram users can now start making stablecoi…","About This Page
This is a Techmeme archive page.
It shows how the site appeared at 4:00 PM ET, April 19, 2024.
The most current version of the site as always is available at our home page.
To vie… [+68 chars]",2024-04-19T20:00:41Z,N/A,N/A,N/A,https://image.cnbcfm.com/api/v1/image/107064032-1652983461893-gettyimages-1240533062-AFP_329P2QC.jpeg?v=1705333166&w=1920&h=1080
45,https://thehackernews.com/2024/05/dutch-court-sentences-tornado-cash-co.html,Internet,News Article,Dutch Court Sentences Tornado Cash Co-Founder to 5 Years in Prison for Money Laundering,"A Dutch court on Tuesday sentenced one of the co-founders of the now-sanctioned Tornado Cash cryptocurrency mixer service to 5 years and 4 months in prison.
While the name of the defendant was redacted in the verdict, it's known that Alexey Pertsev, a 31-year…","A Dutch court on Tuesday sentenced one of the co-founders of the now-sanctioned Tornado Cash cryptocurrency mixer service to 5 years and 4 months in prison.
While the name of the defendant was redac… [+3024 chars]",2024-05-15T08:28:00Z,N/A,info@thehackernews.com (The Hacker News),N/A,https://blogger.googleusercontent.com/img/b/R29vZ2xl/AVvXsEgBPk-hQq2Zp77E2oPvv_a6v5qZcic-fMnamnazYDiOxRjCDkaBpawAz2aJHS5PDYLOy8LhfFefLGVniZ4QQaISgQuJZuDirj3cYon-WnvQVVaaW63p-EBRZuf-qnoa4i_anIXxGiyJ9C35NEN5b5_qwPYZfVuuzLqN4AyPnzFxA-otoo6obsvcDo7ZHidY/s728-rw-e365/cash.png
46,https://thehackernews.com/2024/05/black-basta-ransomware-strikes-500.html,Internet,News Article,"Black Basta Ransomware Strikes 500+ Entities Across North America, Europe, and Australia","The Black Basta ransomware-as-a-service (RaaS) operation has targeted more than 500 private industry and critical infrastructure entities in North America, Europe, and Australia since its emergence in April 2022.
In a joint advisory published by the Cybersecu…","The Black Basta ransomware-as-a-service (RaaS) operation has targeted more than 500 private industry and critical infrastructure entities in North America, Europe, and Australia since its emergence i… [+5154 chars]",2024-05-13T10:01:00Z,N/A,info@thehackernews.com (The Hacker News),N/A,https://blogger.googleusercontent.com/img/b/R29vZ2xl/AVvXsEiWOHiEN0OtwESEetnjfH3hslYWDThSiGHFocrzKqZP6Uw3kErdgYV3a8xnpiWkPxNyc5M5ZkuTaW_G3Z5GF9V6x1yiDtyVdWG4l4EB5svc6q1fKaBM9TNj-7MQl8d5nLuiMdGRo_qrjdGhPk8ZetizQPSb2We9cH-opXOdDoQ7J2LLMHrMKUiM53JI6D7D/s728-rw-e365/ransomware.png
47,https://qz.com/bitcoin-crypto-cryptocurrency-glossary-terms-vocabulary-1851465015,Quartz India,News Article,Bitcoin and crypto have a lot of terms. We've got a glossary for what you need to know,"Since its inception, Bitcoin has captured the attention of countless individuals, which has led to the creation of a bustling cryptocurrency industry. As the crypto industry is new, its terms and jargon are often unfamiliar, which makes it difficult to unders…","Tokens, cryptocurrencies, and digital assets are often used interchangeably but are different from each other.
Digital asset is a broader term that refers to assets that exist in digital form and ca… [+799 chars]",2024-05-12T09:00:00Z,N/A,Vinamrata Chaturvedi,N/A,"https://i.kinja-img.com/image/upload/c_fill,h_675,pg_1,q_80,w_1200/a950909b5704cc09ecb4fff8fc907aa0.jpg"
48,https://qz.com/doj-charges-brothers-with-fraud-for-25-million-crypto-1851479457,Quartz India,News Article,Two crypto thieves have been charged in a $25 million Ethereum heist,"The U.S. Department of Justice has arrested two brothers for attacking the Ethereum blockchain and stealing $25 million worth of cryptocurrency within 12 seconds, it said in an unsealed indictment on Wednesday. Read more...","The U.S. Department of Justice has arrested two brothers for attacking the Ethereum blockchain and stealing $25 million worth of cryptocurrency within 12 seconds, it said in an unsealed indictment on… [+1299 chars]",2024-05-15T18:56:00Z,N/A,Francisco Velasquez,N/A,"https://i.kinja-img.com/image/upload/c_fill,h_675,pg_1,q_80,w_1200/58792bf48288be1f876db0ab3cfff084.jpg"
49,https://qz.com/bitcoin-halving-dogecoin-ether-solana-litecoin-1851420088,Quartz India,News Article,5 cryptocurrencies to watch as the big Bitcoin 'halving' begins,"Bitcoin will go through it’s latest so-called “halving” event starting Friday. The halving will cut the current reward for mining new coins from 6.25 Bitcoin to 3.125. Halving is an integral part of the Bitcoin blockchain system, which creates a monetary syst…",Bitcoin Cash was created in 2017 after the Bitcoin hard fork. A hard fork is a phenomenon in the blockchain world that happens when the community makes major changes to the blockchain network and cha… [+528 chars],2024-04-18T19:07:00Z,N/A,Vinamrata Chaturvedi,N/A,"https://i.kinja-img.com/image/upload/c_fill,h_675,pg_1,q_80,w_1200/1e76bb26709781d483b3b077a5642584.jpg"
50,https://qz.com/bots-perform-90-of-stablecoin-transactions-1851469004,Quartz India,News Article,Bots perform 90% of stablecoin transactions,"Nearly 90% of tracked stablecoin transactions are not human-involved. According to recent data published by Visa and blockchain data provider Allium, less than 10% of transactions are initiated by actual users, and most are done by bots. This means that only …","Nearly 90% of tracked stablecoin transactions are not human-involved. According to recent data published by Visa and blockchain data provider Allium, less than 10% of transactions are initiated by ac… [+1619 chars]",2024-05-10T14:35:00Z,N/A,Vinamrata Chaturvedi,N/A,"https://i.kinja-img.com/image/upload/c_fill,h_675,pg_1,q_80,w_1200/0d0c483a25f696f26e81a40685626f1c.jpg"
51,https://qz.com/consensys-sues-sec-over-ether-regulation-1851438612,Quartz India,News Article,A crypto company is suing the SEC for overreach in regulating Ether,Ethereum developer and the company behind crypto wallet MetaMask Consensys has filed a lawsuit in a Texas court alleging regulatory overreach by the U.S. Securities and Exchange Commission (SEC). The company filed a complaint in the U.S. District Court for th…,Ethereum developer and the company behind crypto wallet MetaMask Consensys has filed a lawsuit in a Texas court alleging regulatory overreach by the U.S. Securities and Exchange Commission (SEC). The… [+1811 chars],2024-04-26T17:04:00Z,N/A,Vinamrata Chaturvedi,N/A,"https://i.kinja-img.com/image/upload/c_fill,h_675,pg_1,q_80,w_1200/883b9565dfc0abfbbb45df125b643ddc.jpg"
52,https://qz.com/bitcoin-dogecoin-and-shiba-inu-didn-t-join-the-gamest-1851479409,Quartz India,News Article,Bitcoin and the 'memecoins' didn't join the meme stock party. Here's why,"This week, meme stocks came back into the limelight after Roaring Kitty, the investor behind the GameStop saga in 2021, made a comeback on social media and sparked a renewed frenzy, lifting other meme stocks. Read more...","This week, meme stocks came back into the limelight after Roaring Kitty, the investor behind the GameStop saga in 2021, made a comeback on social media and sparked a renewed frenzy, lifting other mem… [+2395 chars]",2024-05-15T17:58:00Z,N/A,Vinamrata Chaturvedi,N/A,"https://i.kinja-img.com/image/upload/c_fill,h_675,pg_1,q_80,w_1200/25d841df97e756442e53d86c402bbc76.jpg"
53,https://qz.com/bitcoin-up-after-halving-66000-1851426185,Quartz India,News Article,"Bitcoin is chilling at $66,000 after the 'halving'","Bitcoin has experienced a modest rise after its halving event, with the top cryptocurrency sitting stable at $66,000—a nearly 2% gain—on Monday morning.Read more...","Bitcoin has experienced a modest rise after its halving event, with the top cryptocurrency sitting stable at $66,000a nearly 2% gainon Monday morning.
Bitcoin went through the halving phase on Frida… [+1375 chars]",2024-04-22T15:58:00Z,N/A,Vinamrata Chaturvedi,N/A,"https://i.kinja-img.com/image/upload/c_fill,h_675,pg_1,q_80,w_1200/0a7ad9edb6e519eb0cd150eb82075f26.jpg"
54,https://qz.com/bitcoin-bitcoin-halving-cryptocurrency-1851421828,Quartz India,News Article,"Bitcoin passes $65,000 on the big 'halving' day","After days of tumultuous trading, Bitcoin finally reached $65,000 Friday morning, thanks to its big halving event. The jump in Bitcoin price is a relief for investors as giant banks such as JPMorgan and Goldman Sachs were less confident about the top cryptocu…","After days of tumultuous trading, Bitcoin finally returned to above the $65,000-level Friday morning, thanks to its big halving event. The jump in Bitcoin price is a relief for investors after analys… [+1448 chars]",2024-04-19T14:38:00Z,N/A,Vinamrata Chaturvedi,N/A,"https://i.kinja-img.com/image/upload/c_fill,h_675,pg_1,q_80,w_1200/0ddbd47a359dbefbb14c16d0ffe99a95.jpg"
55,https://qz.com/bitcoin-ether-meta-ibm-microsoft-google-alphabet-1851435315,Quartz India,News Article,"Bitcoin falls below $64,000 as Meta, Microsoft and Alphabet continue to drop","Bitcoin fell below $64,000 Thursday morning as tech stocks continued to decline. The flagship cryptocurrency was trading around $63,240 in mid-morning, with a drop of over 2.5%.Read more...","Bitcoin fell below $64,000 Thursday morning as tech stocks continued to decline. The flagship cryptocurrency was trading around $63,240 in mid-morning, with a drop of over 2.5%.
The price decline co… [+1444 chars]",2024-04-25T15:41:00Z,N/A,Vinamrata Chaturvedi,N/A,"https://i.kinja-img.com/image/upload/c_fill,h_675,pg_1,q_80,w_1200/bb0a246a712207e445065f65d8e5a909.jpg"
56,https://qz.com/billionaire-stanley-druckenmiller-cut-nvidia-stake-1851460512,Quartz India,News Article,A billionaire Nvidia investor says he cut his stake: 'AI might be a little overhyped now',"Premier chipmaker Nvidia has been on a streak this year due to the artificial intelligence boom, but not all of its investors are fully buying into the hype.Read more...","Premier chipmaker Nvidia has been on a streak this year due to the artificial intelligence boom, but not all of its investors are fully buying into the hype.
Stanley Druckenmiller said he cut his st… [+1719 chars]",2024-05-07T14:02:00Z,N/A,Britney Nguyen,N/A,"https://i.kinja-img.com/image/upload/c_fill,h_675,pg_1,q_80,w_1200/675a32f44aef3e2c9799a22abedc160e.jpg"
57,https://qz.com/sec-send-wells-notice-to-robinhood-for-selling-unregist-1851458340,Quartz India,News Article,The U.S. SEC is cracking down on Robinhood’s crypto division for selling unregistered securities,The crypto arm of trading platform Robinhood has received a Wells notice from the Securities and Exchange Commission (SEC) over allegedly violating securities laws.Read more...,"The crypto arm of trading platform Robinhood has received a Wells notice from the Securities and Exchange Commission (SEC) over allegedly violating securities laws.
A Wells notice is a formal notifi… [+2050 chars]",2024-05-06T17:20:00Z,N/A,Vinamrata Chaturvedi,N/A,"https://i.kinja-img.com/image/upload/c_fill,h_675,pg_1,q_80,w_1200/97532248f2833b7c8d254a790cff7945.jpg"
58,https://qz.com/bitcoin-bicoin-halving-jpmorgan-goldman-sachs-1851418943,Quartz India,News Article,"Don't count on a big Bitcoin rally after the big 'halving' event, JPMorgan says","This year’s Bitcoin “halving” event will be different than past ones, as the top cryptocurrency might actually lose value in the aftermath instead of rallying. That’s according to an analysis from JPMorgan, CoinDesk reports. The bank has predicted a decline i…","This years Bitcoin halving event will be different than past ones, as the top cryptocurrency might actually lose value in the aftermath instead of rallying. Thats according to an analysis from JPMorg… [+2097 chars]",2024-04-18T14:32:09Z,N/A,Vinamrata Chaturvedi,N/A,"https://i.kinja-img.com/image/upload/c_fill,h_675,pg_1,q_80,w_1200/ac5df5d52f89f7e277698fed171e91e6.jpg"
59,https://finance.yahoo.com/news/binance-cz-fortunes-set-grow-210032214.html,Yahoo Entertainment,News Article,"Binance and CZ’s Fortunes Are Set to Grow, Jail or no Jail","(Bloomberg) -- It’s “better to ask for forgiveness than permission” when it comes to complying with the law, the billionaire founder of the Binance...","(Bloomberg) -- Its better to ask for forgiveness than permission when it comes to complying with the law, the billionaire founder of the Binance cryptocurrency exchange once told his team, according … [+12297 chars]",2024-04-29T21:00:32Z,N/A,Olga Kharif and Muyao Shen,N/A,https://s.yimg.com/ny/api/res/1.2/0bcv6LIG1RaLRpzx0KtNEQ--/YXBwaWQ9aGlnaGxhbmRlcjt3PTEyMDA7aD04MDA-/https://media.zenfs.com/en/bloomberg_technology_68/cc33326ca6b8a9c6b13865bb5c857446
60,https://www.businesstimes.com.sg/companies-markets/banking-finance/more-90-stablecoin-transactions-arent-real-users-study-finds,Business Times,News Article,"More Than 90% of Stablecoin Transactions Aren't From Real Users, Study Finds...","MORE than 90 per cent of stablecoin transaction volumes are not coming from genuine users, according to a new metric co-developed by...","MORE than 90 per cent of stablecoin transaction volumes are not coming from genuine users, according to a new metric co-developed by Visa, suggesting such crypto tokens may be far away from becoming … [+3229 chars]",2024-05-06T01:52:38Z,N/A,N/A,N/A,https://cassette.sphdigital.com.sg/image/businesstimes/1cca3e0b23ea22c0f4946d998bba4b470cb55910dd96166718792e0ce847f42d
61,https://androidguys.com/promoted-news/is-your-android-ready-for-the-next-wave-of-online-crypto-casinos/,AndroidGuys,News Article,Is Your Android Ready for the Next Wave of Online Crypto Casinos?,"Cryptocurrencies started out as currencies alternative to traditional means like cash and card. Once they gained popularity, it became a popular payment method – especially in online casinos. While iOS is a popular operating system in a mobile setting, there …","Cryptocurrencies started out as currencies alternative to traditional means like cash and card. Once they gained popularity, it became a popular payment method – especially in online casinos. While i… [+5895 chars]",2024-04-23T20:22:45Z,N/A,AndroidGuys,N/A,https://i0.wp.com/androidguys.com/wp-content/uploads/2024/04/cryptocasino_image.webp?fit=1024%2C1024&ssl=1
62,https://newrepublic.com/article/180462/25-political-influencers-watch-2024,The New Republic,News Article,25 Political Influencers to Watch in 2024,"The White House Correspondents’ Dinner, that lavish, storied fundraiser held every April at the Washington Hilton to honor journalists covering the capital, confers on its deep-pocketed attendees the implicit assurance that they belong among the powerful. Buy…","The White House Correspondents Dinner, that lavish, storied fundraiser held every April at the Washington Hilton to honor journalists covering the capital, confers on its deep-pocketed attendees the … [+32461 chars]",2024-04-23T10:00:00Z,N/A,The New Republic,N/A,https://images.newrepublic.com/707f92467494437a4a42aae9c57ea76741378507.jpeg?w=1200&h=630&crop=faces&fit=crop&fm=jpg
63,https://appadvice.com/post/l3e7-is-an-innovative-location-based-game-with-nfts/779709,Appadvice.com,News Article,L3E7 Is an Innovative Location Based Game with NFTs,"If Pokemon GO was one of the defining games of Web2, L3E7 is shaping up to be the Pokemon GO of Web3. 
That’s a big (and slightly confusing) claim, so read on to find out why you need to have L3E7 on your radar. 
Created by a team of developers with more than…","Thats a big (and slightly confusing) claim, so read on to find out why you need to have L3E7 on your radar. 
Created by a team of developers with more than 50 games and multiple AAA credits under th… [+1807 chars]",2024-04-19T17:09:43Z,N/A,AppAdvice Staff,N/A,https://siri-cdn.appadvice.com/wp-content/appadvice-v2-media/2024/04/l1_0b83299eff66d18827092d9572d91ba0.jpg
64,https://economictimes.indiatimes.com/markets/options/unchecked-retail-fo-play-could-trigger-challenges-for-market-fm/articleshow/110131289.cms,The Times of India,News Article,Unchecked retail F&O play could trigger challenges for market: FM,"Finance minister Nirmala Sitharaman highlighted the importance of investor sentiment and financial stability at the Viksit Bharat 2047 event. She stressed the role of both BSE and NSE in ensuring market stability, leveraging technology for efficiency, and ado…","Mumbai: Finance minister Nirmala Sitharaman on Tuesday said unchecked trading by individuals in the futures &amp; options (F&amp;O) segment could trigger challenges for the market. ""Any unchecked exp… [+1743 chars]",2024-05-15T01:32:05Z,N/A,ET Bureau,N/A,"https://img.etimg.com/thumb/msid-110131290,width-1200,height-630,imgsize-189462,overlay-etmarkets/photo.jpg"
65,https://www.nakedcapitalism.com/2024/05/taxcast-142-blockchain-havens.html,Nakedcapitalism.com,News Article,TaxCast #142: Blockchain Havens,How blockchain/crypto tax havens are displacing traditional tax havens.,"Yves here. As we warned from the outset, the use cases for cryptocurrencies are tax evasion and other criminal activity, and speculation. This TaxCast describes how blockchain plus crypto are becomin… [+49436 chars]",2024-05-01T13:55:11Z,N/A,Yves Smith,N/A,N/A
66,https://www.nakedcapitalism.com/2024/05/defending-privacy-in-the-surveillance-state-and-fragmenting-internet.html,Nakedcapitalism.com,News Article,Defending Privacy in the Surveillance State and Fragmenting Internet,Governments and private entities are eroding privacy on the internet. Is it possible to safeguard both openness and security in cyberspace?,"Yves here. One of the problems with defending privacy, much like masking, is other people. I am very anti-social and still encounter pressure to engage in activities that expose way too much informat… [+15517 chars]",2024-05-17T13:56:37Z,N/A,Yves Smith,N/A,N/A
